place,info,문의 및 안내,홈페이지,주소,이용시간,휴일,주차,지정현황,입장료,review,체험가능 연령,화장실,체험 프로그램,이용 시기,주차 요금,이용요금,주요시설,접근로,장애인 주차 안내,휠체어,수용인원,규모,출입통로,엘리베이터,수유실,판매 품목,시설이용료,체험프로그램,유모차,점자 홍보물,"영유아가족
기타상세",이용가능시설,주차요금,대중 교통,시각장애 기타상세,오디오 가이드,지체장애 기타 상세,유아용보조의자,개장기간,관람석,부대시설,보유장비,보조견 동반,대여안내,점자 블록,안내 요원
화산산성,"화산산성은 해발 828m 화산 정상부에 외부로부터 침입을 막기 위해 조선 후기에 쌓았다. 둘레는 약 9,300보, 높이가 10척으로 기록되어 있다. 조선 숙종 35년(1709)에 병마절도사 윤숙이 군대를 주둔시키기 위해 동쪽과 서쪽, 남쪽과 북쪽 사방 문의 기초 공사를 시작하였다. 성벽을 쌓기 위해 돌로 된 재료를 모으고 수구문을 쌓던 중 흉년과 질병이 겹쳐 공사가 중지되었고, 그 후 계속 지금의 상태로 두었다고 한다. 조선 중기 이후 유행한 2층 수구의 형태, 조선 후기 성문과 성벽 등 성을 쌓던 기법과 공사의 순차를 연구하는 데 귀중한 자료이다.",,http://www.gunwi.go.kr/tour,대구광역시 군위군 삼국유사면 화북리 산230,상시 개방,연중무휴,불가능,대구광역시 기념물 화산산성 (1984.05.21. 지정),무료,마을의 조형물이 예쁘긴했고 올라가며 경치는 좋았지만 특별히 볼것도 없어 조금은 허무했어요 근처 캠핑장도 있고 대구 근교라 차박도 많은것 같습니다 밤하늘 별 보기도 좋고 조용한 시골 분위기도 너무 좋네요 힐링됩니다,,,,,,,,,,,,,,,,,,,,,,,,,,,,,,,,,,,,
혜원의 집,혜원의 집은 2018년 개봉해 150만 명의 관객을 모았던 영화 ‘리틀 포레스트’ 주인공 혜원(배우 김태리)의 집이다. 군위군의 대표적인 관광지 중 한 곳인 혜원의 집은 촬영당시 모습을 그대로 보존하여 영화에서 느꼈던 감동을 그대로 느낄 수 있다. 고즈넉한 집과 마을을 거닐다 보면 어느새 나도 모르게 마음의 위로를 받을 수 있다.,,https://www.gunwi.go.kr/tour/main.do,대구광역시 군위군 우보면 미성5길 58-1,09:00~18:00,연중무휴,가능,,무료,영화 리틀포레스트 촬영지를 지나는길에 우연히 발견하고 방문하게 되었습니다. 영화속에서 음식하던 김태리가 생각나게 하는 곳이었고 자전거도 탈수있게 준비되어 있습니다. 볼거리가 많지는 않지만 지나는 길에 잠시 들려보기 좋은곳입니다. 영화 촬영지였던 장소에 가서 영화에서 전하고자 했던 감정을 느켜보고 싶었어요 주변의 평화로움 추수가 킅난 논에서 평화가느껴지며 혜원이가 자전거 탄길에서 나도 자전거를 타보고 싶었어요 자전거가 불량상태라. 자전거 타기가 힘들엏지만 그곳에서 체험하고. 싶고 느키고 싶었던것. 충분히 느낀것같아서. 참좋았어요,전 연령,,,,,,,,,,,,,,,,,,,,,,,,,,,,,,,,,,,
한천서원,"이 서원은 고려개국공신 태사 충렬공 전이갑과 충강공 전의갑 형제를 기리기 위해 세워진 곳이다. 팔공산 동수에서 견훤군과 맞서 싸우다 태조 왕건을 피신시키고, 장절공 신숭겸 장군등과 함께 장렬히 전사하여 그들의 영명을 후세에까지 남겼다. 뒷날 태조가 몹시 슬퍼하여 전이갑은 통합삼한개국공신 태사 충렬공으로 추증하고 전의갑은 시중개국공신 충강공으로 봉하였다. 공의 충절이 병조, 예조등 열성조 수교가 조선왕조에도 전교되어 서기 1864년(고종 8년)에 서원 철폐령으로 훼철된 후 설단하고 제각을 지어 공의 높은 충의를 기려오다가 서기 1989년 서원으로 복원되었다. 대지 800평 규모에 1곽 3동으로 되어 있으며 뜰에는 달성군 보호수 8-1호인 1000년 된 은행나무가 있다.

(출처 : 대구트립로드)",,https://tour.daegu.go.kr/index.do,대구광역시 달성군 가창면 가창동로 117,상시 개방,연중무휴,가능,,무료,,,,,,,,,,,,,,,,,,,,,,,,,,,,,,,,,,,,,
달성 태고정,"달성태고정은 조선 성종 10년(1479) 박팽년의 손자인 박일산이 세운 별당건축이다. 지금 있는 건물은 선조 25년(1592) 임진왜란 때 불타서 일부만 남았던 것을 광해군 6년(1614)에 다시 지은 것이다. 항상 바르고 올곧게 살자는 뜻에서 일시루라고도 한다. 대청에는 윤두수의 한시를 새긴 현판과 정유재란 후 이곳에 온 명나라 선무관이 남긴 현판 등이 걸려 있다
네모난 모양의 단 위에 서 있으며 앞면 4칸 ·옆면 2칸 크기로, 동쪽 2칸은 대청마루이고, 서쪽 2칸은 방으로 꾸몄다. 대청 앞면은 개방되어 있는데 옆면과 뒷면에는 문을 달았을 것으로 추정한다. 대청 앞 기둥 사이에는 2층으로 된 난간을 설치하였다.
규모는 그리 크지 않은 건물이지만 가구나 세부 가공이 정교할 뿐만 아니라 초익공계의 정교한 가구 구성을 갖추었기에, 건축사적 가치를 지닌 건물로 평가되고 있다.
태고정 주변으로 도곡재와 육신사, 충효당이 있으며 사육신기념관을 방문하여 사육신과 박팽년에 대한 전시 및 영상 자료를 관람할 수 있다.",,https://tour.daegu.go.kr,대구광역시 달성군 하빈면 육신사길 64,,,가능,대구 보물 달성 태고정 (1971.12.06. 지정),,,,있음,,,,,,,,,,,,,,,,,,,,,,,,,,,,,,,,,,
달성 하목정,"달성 하목정은 임진왜란 때 의병장이었던 낙포(洛浦) 이종문(李宗文)이 1604년(선조 37)에 세운 것이다. ‘하목정’이라는 정호(亭號)는 인조가 왕위에 오르기 전에 이곳에 머문 적이 있어 그 인연으로 이종문의 장남인 이지영에게 직접 써 준 것이다. 이곳은 조선 중기에 건립된 평면형태가 독특한 정자형 별당 건축으로 공간구성과 세부기법 및 의장 등에는 많은 특색이 나타나고 있어 역사적, 건축적, 학술적 가치가 뛰어난 곳이다. 정면 3칸, 측면 2칸의 대청과 정면 1칸, 측면 4칸의 방들이 서로 붙어서 전체적으로 독특한 평면으로 구성되어 있다.",,https://www.dalseong.daegu.kr/culture/,대구광역시 달성군 하빈면 하목정길 56-10,상시 개방,연중무휴,가능,보물 달성 하목정 (2019.12.30. 지정),무료,"고전과 현대가 어울리는 목가적인 풍경을 한컷으로 남길수 있는 여행지!!! 인생컷이 가능한 곳입니다 사진 진~~~짜 이쁘게 나와요 여행하기강추입니다~~^^ 목가적인 풍경들이 제대로 힐링을 선사하는 곳이네요. 아름다운 분위기를 느끼며 걷다가 액자 같은 배경에서 사진도 찰칵 찍을 수 있는 곳이예요^^ 문틀이 액차처럼 되어있꽃나무 배경으로 예쁜사진 찟을수있어서 좋았어요 한옥도 너무 예쁘고 주변에 사진찍을 곳도 많아서 좋았습니다 배롱나무도 처음 봤는데 너무 예쁘더라구요 여기 정말 이뻐요!! 사진 찍기도 너무 좋고, 고택이 너무 잘 관리 되어 있어서 좋아요! 배롱나무가 엄청 멋지게 피었답니다 ㅎ 추천해요 사진찍으러 갔다왔어요~ 고택도 잘 관리되어있고 주변도 이뻐서 사진찍기에 좋아요. 나중에 다른 계절에도 가보면 좋을것 같아요! 한옥과 배롱나무가 멋지게 어울러져 예쁜곳이예요. 편하게 들어가서 고택 둘러보는데 운치있고, 배롱나무가 멋드러져서 사진 찍기 좋았어요. 사람들도 생각보다 많더라고요",,,,,,,,,,,,,,,,,,,,,,,,,,,,,,,,,,,,
엄마아빠어렸을적에,"‘엄마 아빠 어렸을 적에’는 화본역 인근에 있는 옛 산성중학교를 리모델링하여 1960, 70년대의 생활상 등을 체험할 수 있도록 한 추억의 테마 박물관이다. 추억의 학교에는 40~50여 년 전의 시골학교 교실을 비롯하여 이발소, 사진관, 소리사, 만화방, 문방구, 구멍가게, 연탄가게 등이 그대로 재현되어 있다. 옛날 교복과 옛날 오락, 승마 등 여러 체험 요소가 많아 추억여행이나 촬영지 등으로 관광객들이 많이 찾는 군위의 관광지이다.",,"대구 문화관광 https://tour.daegu.go.kr
화본마을 http://화본마을.com",대구광역시 군위군 산성면 산성가음로 722,"- 3월~10월 09:00~18:00
- 11월~2월 09:00~17:00
※ 관람종료 30분 전까지만 입장가능",연중무휴,가능,,"- 중학생~성인 3,000원
- 어린이(만 3세)~초등학생 2,500원
- 단체(25명 이상) 1,500원
※ 평일에는 일부 유료 체험은 불가능
※ 유료체험요금은 별도 부과","여긴 아이와 몇번이나 간곳 입니다 부모님은 추억이 새록새록 아이들은 새로운 경험으로 즐거운 시간 보낼수 있는곳 인것 같아 추천합니다 추억 있는 옛 물건들이 전시되어 있는 곳입니다. 입장료 대비 전시품이 많지는 않은것 같습니다. 주차장은 길 건너편 역쪽에 주차 후 이용해야 합니다. 기념품으로 차량용 방향제 구매 했는데 매우 만족스럽습니다. 온가족이 군위에 있는 엄마 아빠 어렸을 적에 다녀 왔어요 요즘 애들이 보기에는 신기한 것도 많이 있어요 어른들에게는 추억이 새록새록 생각나기도 하구요 예전 교복을 입을수도 있게 되어 있는데 저도 생소한 교련복 이더라구요 ㅎ 애들 사이즈에 맞게 접어서 입히고 사진 찍으니 정말 귀엽게 잘나왔어요 즐거운 과거로릐 여행 잘다녀 왔습니다 운동장에 소소하게 아이들 놀거리가 있어서, 생각보다 오래 머물렀어요. 옛날과자. 음료등이 가격이 싸고, 달고나는 정말 작품을 만들어주시는 달인이 계셔서 강추합니다. 몇해전 찾았을탠 좋았어요 그 추억으로 다시금찾았는데 그동안 변한부분도 많더군요주말이 아니어서 체험이. 이루어지지 안쓴다는것은 이해되었으나 모든가게도 문이 다혀있더군요 주말입장료와 같은 입장료를 받는다는것 이 도무지 이해가 되지 않았어요 말 그대로 저 어릴 적이라고 하기엔 세대가 더 윗 세대이지만 충분히 공감이 가는 곳 입니다. 졸업한 중학교가 이렇게 변해서 군위의 명소가 되었다니 자랑스럽네요",전연령,,"유료체험, 무료체험, 꽃마을 체험장",,,,,,,,,,,,,,,,,,,,,,,,,,,,,,,,,
광덕사(대구),"대구 달성군에 위치한 광덕사는 대한불교조계종 제9교구 본사 동화사 소속 사찰이다. 이 사찰은 1967년 정운성에 의해 창립되었다. 광덕사는 납골당도 함께 운영하고 있다. 부처님 오신 날과 같은 특별한 날에는 많은 사람들이 이곳을 방문한다. 사찰 건물로는 대웅보전, 산신각, 독성각, 요사채가 있으며, 사찰 입구에는 범종각과 포대 화상이 자리하고 있다. 이 사찰은 고즈넉한 자연 속에 자리 잡고 있으며, 방문객들에게 평화롭고 조용한 분위기를 제공한다.",,,대구광역시 달성군 가창면 헐티로 1190,상시 개방,연중무휴,가능,,무료,,,있음,,,,,,,,,,,,,,,,,,,,,,,,,,,,,,,,,,
원호루,"원호루는 1897년(고종 34) 현풍 현령홍필주가 관직에 있을 때 인근 현령과 지방유생들이 정사를 논의하고 풍류와 여흥을 즐기기 위하여 지은 것이라 전해진다. 원래는 현재의 현풍읍사무소 후원 동산에 있었으나 1989년 면사무소를 증축하며 해체되었다가, 초대 민선 달성 군수 양시영에 의해 1996∼1998년 현 위치로 옮겨와 복원되었다. 처음에는 2층의 아담한 누각이었으나, 1957년 중건하면서 높은 댓돌 위에 단층으로 바뀌었다. 복원된 현 누각은 자연산 주초석을 자재로 하여 기둥 위에 정면 3칸, 측면 2칸의 이익공 양식의 겹처마 팔작 기와지붕이다. 작은 산의 정상 부근에 위치하여 원호루 누각에 오르면 파노라마처럼 펼쳐지는 주변 숲의 초록으로 가득한 풍경을 볼 수 있다. 원호루 인근으로 석빙고와 상리체육공원, 사직단 등을 연결하는 산책로를 이용하여 반나절의 짧은 시간 안에 연계해서 둘러볼 수 있다.",,,대구광역시 달성군 현풍면 현풍동로 92,,연중무휴,가능,,,,,,,상시 개방,,,,,,,,,,,,,,,,,,,,,,,,,,,,,,,,
도곡재,"도곡재는 대구광역시 유형문화유산으로 지정된 곳으로 달성군 하빈면에 위치하였다. 조선 정조 2년(1778)에 대사성인 서정공 박문현이 살림집으로 세운 건물이나, 정조 24년(1800) 경에 도곡 박종우의 공부방으로 사용되면서 그의 호를 따서 도곡재라는 이름을 붙였다. 앞면 4칸·옆면 1칸 규모이며, 후대에 퇴칸을 달고 대청을 넓혀 누(樓)처럼 꾸몄다. 도곡재는 태백산지역 살림집의 일반적인 구조를 가지고 있는 소박한 건물이다.",,,대구광역시 달성군 하빈면 육신사길 62,상시 개방,연중무휴,"가능
요금 (무료)",대구광역시 유형문화유산 도곡재 (1995.05.12. 지정),,,,,,,,,,,,,,,,,,,,,,,,,,,,,,,,,,,,,,
대덕승마장,"대덕승마장은 대구 달서구 송현동에 위치한 승마장이다. 승마를 국민 스포츠로 자리매김시키기 위해 비교적 저렴한 요금으로 초급, 중급, 고급 강습을 운영한다. 강습은 기승하는 말의 역사와 행동을 이해하고 말과 사람 간의 교감을 중심으로 진행된다. 가족적인 분위기 속에서 누구나 쉽고 편안하게 승마를 체험할 수 있는 환경을 조성하고 있다. 누구나 승마의 즐거움을 쉽게 접할 수 있도록 노력하고 있다.",,http://dghorse.dgsisul.or.kr/,대구광역시 달서구 앞산순환로 206 (송현동),09:00~18:00 (휴게 시간 12:00~13:00),매주 월요일,가능,,,,,,,,무료,"- 체험승마 (주말) 12,000원
- 입문강습 250,000원
※ 이용요금은 변동될 수 있으므로 홈페이디 참고",마사 / 실내마장 / 강의실 등,,,,,,,,,,,,,,,,,,,,,,,,,,,,,
화산산성,"화산산성은 해발 828m 화산 정상부에 외부로부터 침입을 막기 위해 조선 후기에 쌓았다. 둘레는 약 9,300보, 높이가 10척으로 기록되어 있다. 조선 숙종 35년(1709)에 병마절도사 윤숙이 군대를 주둔시키기 위해 동쪽과 서쪽, 남쪽과 북쪽 사방 문의 기초 공사를 시작하였다. 성벽을 쌓기 위해 돌로 된 재료를 모으고 수구문을 쌓던 중 흉년과 질병이 겹쳐 공사가 중지되었고, 그 후 계속 지금의 상태로 두었다고 한다. 조선 중기 이후 유행한 2층 수구의 형태, 조선 후기 성문과 성벽 등 성을 쌓던 기법과 공사의 순차를 연구하는 데 귀중한 자료이다.",,http://www.gunwi.go.kr/tour,대구광역시 군위군 삼국유사면 화북리 산230,상시 개방,연중무휴,불가능,대구광역시 기념물 화산산성 (1984.05.21. 지정),무료,마을의 조형물이 예쁘긴했고 올라가며 경치는 좋았지만 특별히 볼것도 없어 조금은 허무했어요 근처 캠핑장도 있고 대구 근교라 차박도 많은것 같습니다 밤하늘 별 보기도 좋고 조용한 시골 분위기도 너무 좋네요 힐링됩니다,,,,,,,,,,,,,,,,,,,,,,,,,,,,,,,,,,,,
안지랑 곱창골목,안지랑 곱창골목은 안지랑오거리에서 앞산 안지랑골로 통하는 길 중간에 형성된 곳이다. 양념 곱창집들이 즐비한 곱창 골목으로 1979년경 충북식당을 시작으로 1998년 IMF 이후 생계유지 업소가 늘어나기 시작해 오늘에 이르렀다. 서민들이 부담 없이 즐길 수 있는 휴식처이자 최근엔 젊은 층이 주도하는 젊음의 거리로 발전하였다. 2012년에는 문화체육관광부 주관 전국 5대 음식테마거리로 선정된 바 있다.,,,대구광역시 남구 안지랑로16길 67,※ 점포별 상이함,※ 점포별 상이함,"가능
요금 (무료)",,,"일본인 친구들이 오면 항상 안지랑 곱창골목을 소개해주는데 매번 반응이 좋습니다. 이번에는 운이좋게도 관광공사가 함께하는 이벤트시기와 맞아서 친구가 맛있는 곱창세트도 먹고 가게에서 받은 쿠폰을 잘 활용해서 관광안내소에서 기념품도 받았습니다. 외국인친구가 한국과 대구의 좋은 기억을 가지고 돌아가서 더 뜻깊었습니다. 대구여행하면 빼놓을 수 없는 곳이죠! 1월의 마지막 주말에 다녀왔는데~ 오랜만에 방문해도 여전히 맛있었고, 행복한 식사였습니다! 곱창집이 즐비한 골목에서 어떤 가게를 선택할지 행복한 고민도 재밌었구요! 곱창 양이 어마 무시합니다~~^^ 안지랑 곱창이 먹고싶어서 타지역인 대구까지 방문한다고 해도 시간이 아깝지 않았어요!^^ 포장도 가능해서 좋았어요!",,있음,,,,,,,,,,,,,,,,,,,,,,,,,,,,,,,,,,
대구제일교회,"대구제일교회는 1893년에 설립된 교회로 경상북도, 대구시 최초의 교회이며, 약령시 약전골목 한복판 약령시 한방박물관, 대구교남 YMCA회관과 같이 있다. 대구 최초의 천주교 성당인 계산주교좌성당과는 서성로를 사이에 두고 서로 마주 보고 있다. 예전에는 성안에 있다 해서 성내교회 혹은 남문안에 위치하여 남문안예배당, 남문내교회로도 불리었다.
건물은 전형적인 고딕 양식으로 서유럽의 이국적인 느낌을 준다. 건물의 층수는 2층이며, 종탑은 5층이고 높이는 33m이다. 위치의 특성상 약령시 한방문화페스티벌이나 대구시 주요 축제 때 주 관광지가 되며 대구 시내 투어나 대구 근대 골목길 코스에도 포함되어 많은 사람들이 관광을 목적으로 방문하는 곳이다. 최초의 예배당은 기존의 한옥집을 1896년에 매입해 사용하여 남성정 교회로 이름하다가, 1908년에 두 번째 예배당을 지었다. 두 번째 예배당은 미국인 선교사들과 한국인 전통 목수들이 함께 지은, 단층의 건물로 교회의 정면 한가운데 출입구를 겸한 종탑을 세우고 그 양쪽에 세로로 긴 창문을 규칙적으로 배치하여 좌우가 대칭을 이루었다. 이 건물의 양철지붕, 창문, 종탑 등은 당시 대구 부민들에게는 매우 이색적이고 경이로운 것으로 오랫동안 구경거리가 되었다고 한다. 그러나 1931년 철거했고 새로 1933년 세 번째 예배당으로 사용하기 위하여 2층으로 건물을 준공하였고 제일교회로 이름을 바꾸었다.
1936년에 고딕 양식의 종탑을 추가적으로 세워 현재의 모습이 되었다. 종탑부는 1층에서 5층까지 창문이 제각기 다르게 설계됐고 윗부분에는 팔각형의 뾰족탑을 세웠다. 이 같은 특성과 역사성에 기인하여 1992년 본당과 종탑이 대구유형문화재 제30호로 지정되었다. 이 건물의 전체적인 양상은 평면이 남북으로 긴 직사각형이고, 앞면 중앙에 현관을 두고 오른쪽에는 종탑을 세운 간결한 고딕 건물이다. 대구 제일교회는 대구의 수많은 교회 건물 중 가장 오랜 역사를 가졌고, 기독교가 근대화에 기여한 상징물로서 근대 건축사 연구에 귀중한 자료가 되고 있다. 1994년 동산동으로 본당을 건축하여 갔으며 이곳은 100여년간 대구제일교회로 사용된 곳이다. 이후 약령시한의학박물관 옆에서 기독교 역사관으로 운영되고 있다. 기독교역사관에는 개화기 시절 사용했던 성경, 찬송가, 헌금함 등 다양한 물품과 당시의 사진 등이 전시되어 있다. 또한, 대구제일교회의 연혁, 역사, 선교사들의 활동 이야기가 기록, 전시되어 있다. 1919년 3·1 운동에 참여한 교회로서 독립선언문의 탁본을 만들어 볼 수 있는 체험 공간도 마련되어 있다.",,http://www.firstch.org/Page/Index/879,대구광역시 중구 국채보상로102길 50 (동산동),10:00~17:00,매주 일~월요일,가능,대구광역시 유형문화유산 (1992.01.07. 지정),무료,근대골목투어할때 지나게 되는 코스중 하나에 제일교회가 있어요. 여기에서 근대골목투어 스탬프 하나 찍을수 있구요. 대구에서 가장 오래된 기독교 건물이라 대구유형문화재로 지정되어 있다고 하더라구요. 그냥 보기에도 약간 영화에서 보던 서양중세건물 느낌이라 오래된 건축물 같아 보였어요. 대구 최초의 서양식 건물인 계산성당 바로 근처에 있어서 찾기 어렵지 않았어요. 근대골목투어를 통해 방문했었는데 설명과 함께 야간의 교회 모습을 볼 수 있어서 좋았습니다 가보면 너무 예쁜 건축물의 모습에 반했어요. 현재와 과거가 공존하는 교회의 모습에 인증샷은 필수예요. 동성로도 가까워서 걸어가기 좋은 곳이지만 주차는 쫌 불편해요 근대 최초 교회 소중한 국내여행,,장애인용화장실 있음,독립선언문 탁본 체험,,,,,경사로 있음,장애인 전용 주차구역 있음_무장애 편의시설,,,,,,,,,,,,,,,,,,,,,,,,,,,
모명재,"모명재는 임진왜란 때 명나라 원군으로 참전하였다가 조선에 귀화한 두사충을 기리기 위하여 두릉 두씨 문중에서 건립한 재실이다. ‘모명재’는 고국인 명나라를 사모한다는 뜻이다. 두사충은 중국 두릉 출신으로, 임진왜란이 일어나자 명나라 제독 이여송 휘하의 장수로 조선에 파견되었다. 그는 지세를 살펴 진지를 설치하기에 적합한 장소를 찾는 수륙지획주사라는 직책을 맡았으며, 이여송의 일급 참모로서 조선군과도 전략·전술상의 긴밀한 협의를 진행하였다. 임진왜란이 평정되자 고향으로 돌아갔지만, 정유재란이 발발하자 아들 두산, 두일건과 함께 매부인 진린 도독과 다시 출진하였다.

전란이 끝난 뒤 두사충은 두 아들과 함께 조선에 귀화하였고, 조정에서는 그에게 대구 시내 중앙공원(현 경상감영공원) 일대의 땅을 하사하였다. 이후 그 땅에 경상감영이 들어서자 두사충은 자신의 토지를 내어주고 계산동으로 이주하였다. 고국에 두고 온 부인과 형제들을 그리워하던 그는 최정산(현재의 대덕산) 아래로 거처를 옮기고, 동네 이름을 ‘대명동’이라 붙였다. 또한 단을 쌓아 매월 초하루가 되면 명나라 황제가 있는 자금성 방향으로 배례를 올렸다고 전한다.

모명재는 네모 반듯한 대지 위에 남향으로 배치되어 있으며, 정면 네 칸, 측면 두 칸 규모의 겹처마 팔작기와집이다. 대청을 중심으로 좌우에 온돌방을 두고, 앞쪽에는 반 칸 규모의 퇴칸을 마련하였다. 이 건물은 20세기 초 대구 지역 재실 건축 형식을 잘 보여 주는 사례이다. 모명재는 1912년 경산 객사가 철거되자, 그 재목을 후손들이 옮겨와 두사충의 묘소 앞에 지은 것으로, 1966년에 낡은 건물을 중수하였다. 대구를 방문하는 중국인 관광객들이 가장 먼저 찾는 장소로 알려져 있으며, 최근 재정비 사업을 통해 새롭게 단장되었다.",,https://www.suseong.kr/tour,대구광역시 수성구 달구벌대로525길 14-23 (만촌동),상시 개방,연중무휴,가능,,무료,,전 연령,있음(한국전통문화체험관),,,,,,,,,,,,,,,,,,,,,,,,,,,,,,,,,,
